product,price,reduction,evaluation
"Itel S23 - 6.6"" - 8GO, 128GO - 50MP - Mystery White",229.00 Dhs,7%,3.8 out of 5
"Samsung Galaxy A04e Black 3+32GB 6.5” HD+ PLS LCD 5,000 mAh","1,079.00 Dhs",17%,3.8 out of 5
"Samsung Galaxy A04 - 6.5"" - 4GB RAM + 64GB ROM - 50MP - Black","1,380.00 Dhs",17%,4.5 out of 5
"Itel S23 - 6.6"" - 8GO, 128GO - 50MP - Starry black",69.00 Dhs,7%,5 out of 5
Smart Watch T500 Montre intelligente smart watsh Full  appel étanche fréquence cardiaque,529.00 Dhs,53%,5 out of 5
Smart Watch T500 Montre intelligente Full  appel étanche fréquence cardiaque,"2,648.00 Dhs",64%,2.3 out of 5
Écouteurs sans fil Bluetooth M10 TWS V51 9D stéréo oreillettes de Sport étanches,"2,199.00 Dhs",52%,4 out of 5
"Samsung Galaxy A04 - 6.5"" - 4GB RAM + 64GB ROM - 50MP - Copper",143.00 Dhs,17%,4.5 out of 5
Smart Watch T500 montre intelligente sport fréquence cardiaque moniteur tension,"1,960.00 Dhs",69%,1 out of 5
"Montre connectée 7 pour hommes et femmes, étanche, pour Android et IOS","1,049.00 Dhs",62%,4.7 out of 5
Itel S18 – 6.6″ –  4Go Ram 64 Go Rom – 8Mpx – 5000mAh - Vert,726.00 Dhs,40%,4.6 out of 5
XIAOMI 10000mAh Mi 18W Fast Charge Power Bank 3 black,119.00 Dhs,8%,4.3 out of 5
"XIAOMI Redmi 12C - 6.71"" (4GB - 128GB) - 5000 mAh - 50 MP – Bleu","2,099.00 Dhs",17%,4.4 out of 5
"Samsung Galaxy A04 - 6.5"" - 4GB RAM + 64GB ROM - 50MP - White",142.00 Dhs,67%,3.3 out of 5
TWS ÉCOUTEURS  SANS FIL - I12 5.0 - noir,69.00 Dhs,33%,3.7 out of 5
TWS Écouteurs sans fil Bluetooth M10 TWS V5.1 9D stéréo,"1,079.00 Dhs",67%,4.1 out of 5
Écouteurs sans fil M10 TWS Bluetooth 5.1 stéréo 9D,959.00 Dhs,19%,4.5 out of 5
Samsung Galaxy A14 6.6'' LTE 4+128GB 50 Mpx SILVER,"1,169.00 Dhs",18%,4.8 out of 5
"XIAOMI Redmi 12C - 6.71"" (4GB - 128GB)  - 5000 mAh - 50 MP - Graphite Gray","1,079.00 Dhs",17%,5 out of 5
Samsung Galaxy A04e - 6.5” HD+ PLS LCD - 32GB - 3 Go Ram - Copper,229.00 Dhs,17%,3.7 out of 5
Telefunken Téléphone cellulaire futurephone tf801,"1,169.00 Dhs",77%,3.5 out of 5
Cable iPhone Compatible 5/5C/5S/6/6S/6+/6S+/7/7+ et X,869.00 Dhs,40%,4.1 out of 5
XIAOMI Mi In-Ear Headphones Basic (SILVER) - 1 an de garantie,"1,690.00 Dhs",17%,3.5 out of 5
Itel S18 – 6.6″ –  4Go Ram 64 Go Rom – 8Mpx – 5000mAh - Noir,"1,829.00 Dhs",41%,4.6 out of 5
TWS Y50 écouteurs sans fil bluetooth  casque d'écoute stéréo avec boîte de chargements tws  écouteurs sans fil bluetooth casque d'écoute stéréo avec boîte de chargement,"1,169.00 Dhs",34%,4.4 out of 5
"XIAOMI Redmi Note 11S 8Gb RAM + 128Gb ROM 6.43"" 108MP - Gris - 1 an de garantie","1,380.00 Dhs",64%,3.8 out of 5
"Mibro X1– montre connectée pour hommes et femmes, écran Amoled de 1.3 pouces",69.00 Dhs,60%,4 out of 5
"Samsung Galaxy A04e Light blue 3+32GB 6.5” HD+ PLS LCD 5,000 mAh",959.00 Dhs,61%,3.8 out of 5
TWS TWS F9-5 écouteurs sans fil Bluetooth avec Power bank,99.00 Dhs,80%,3.1 out of 5
TWS i12 Tws Écouteurs Bluetooth 5.0 Wireless headphones avec boîte de charge pour tous les téléphones,"2,648.00 Dhs",17%,3.2 out of 5
Smart watch pour femmes et hommes Y68 pro d20s Bracelet de fitness,229.00 Dhs,55%,4 out of 5
Hoco Chargeur de Voiture Intelligent à Unique Port  USB,"2,648.00 Dhs",60%,3.7 out of 5
"Samsung Galaxy A04e Light blue 3+32GB 6.5” HD+ PLS LCD 5,000 mAh","1,169.00 Dhs",69%,3 out of 5
"TWS Écouteurs Bluetooth sans fil A6S , écouteurs 5.0 ,Mini casque étanche, oreillettes de Sport avec son stéréo en 3D",119.00 Dhs,36%,3 out of 5
Replacement Wrist Strap for Xiaomi Mi Band 5,"1,169.00 Dhs",1%,4.4 out of 5
"Samsung 32"" Smart Tv HD - Récepteur Intégré - TNT - HDMI - 32T5300",977.00 Dhs,57%,4.3 out of 5
"Itel 32"" TV LED HD - Récepteur Intégré - TNT HDMI USB MODEL 2021 - Noir",570.00 Dhs,61%,4.5 out of 5
"Echolink TV 32"" LED HD32V2X Sans cadre-Récepteur satellite intégré & TNT + Support mural","1,157.00 Dhs",22%,4.2 out of 5
"Echolink ENOVA BOX 4K UHD 2GB Ram, 16GB Stockage Compatible NETFLIX 4K Dual WiFi 2.4G/5G",475.00 Dhs,43%,4.9 out of 5
"Telefunken 32"" - LED TV - Décodeur intégré - Garantie 1 an - Noir",20.00 Dhs,11%,4.9 out of 5
BUY SAT 32'' SMART TV - ANDROID - Récepteur Intégré & TNT,"3,030.00 Dhs",45%,4 out of 5
"Visio Smart TV 32"" Android officielle HD - Bluetooth 5.0 Récepteur Intégré HDR - DOLBY",800.00 Dhs,46%,4.7 out of 5
Offfre Caméra WiFi Sans Fil Sécurité Ampoule 1080P 360 degrés Panoramique Vision,"5,459.00 Dhs",61%,4 out of 5
"Visio TV 32"" Pouces HD Led Récepteur intégré + TNT + HDMI + USB",69.00 Dhs,46%,4.1 out of 5
Revolution Support TV mural pour écran LED 14'' - 42'' . 25Kg Avec accessoire de fixation,"3,610.00 Dhs",40%,4.5 out of 5
STUDIO Pack USB Microphone de Studio avec carte son V8 et son Support Flexible,500.00 Dhs,65%,5 out of 5
"Techmania Smart TV 32"" Android HD - Récepteur intégré + TNT + HDMI + USB - Garantie 1 An","3,190.00 Dhs",46%,4.6 out of 5
"Samsung 40"" Smart Tv Full HD - Récepteur Intégré - TNT - HDMI - 40T5300","3,590.00 Dhs",48%,4.7 out of 5
"ampoule camera de surveillance wifi, lampe camera PTZ 1080P rotation 360 E27",405.00 Dhs,69%,2.3 out of 5
Hoco Écouteurs M3 avec microphone Compatible avec samsung iphone oppo nokia ...,80.00 Dhs,33%,2 out of 5
LCD Mini Portable LED Projecteur YG-300,"1,471.00 Dhs",48%,1 out of 5
"Visio 32"" TV HD LED - Récepteur intégré + TNT - Garantie - Noir",966.00 Dhs,67%,4.1 out of 5
VR Box Lunettes vidéo 3D réalité virtuelle avec Bandeau réglable,977.00 Dhs,39%,5 out of 5
VR Box Lunettes 3D Réalité Virtuelle Haute Qualite RK3 Plus  pour Tous mobiles Android iphone,570.00 Dhs,25%,3 out of 5
"BUY SAT 50"" Smart LED TV - 4K Android 11 - 50E7000",959.00 Dhs,31%,4.7 out of 5
"Samsung 43"" Smart Tv Full HD - Récepteur Intégré - TNT - HDMI - 43T5300","1,157.00 Dhs",22%,4.6 out of 5
XIAOMI Mi Home Security caméra IP intelligente 1080P WiFi 360 Angle Vision nocturne,"1,034.00 Dhs",18%,4.6 out of 5
"Itel 32"" - Smart TV - G3250 - Noir",33.00 Dhs,47%,5 out of 5
"SUPPORT MURAL LED LCD TV ROTATIF 180°- 14"" à 42""  Noir","3,030.00 Dhs",40%,1 out of 5
Kingston Carte microSD 64GB Canvas Select Plus SDCS2/64GB,475.00 Dhs,50%,4.7 out of 5
"Echolink ENOVA STICK FULLHD, ANDROID 11, 1GB RAM DDR4, 8GB ROM, Compatible NETFLIX","3,219.00 Dhs",49%,4.8 out of 5
X96 PRO Smart TV BOX Dual Wifi 4Go+64Go Allwinner H616 6K ANDROID 11,"1,389.00 Dhs",71%,3.7 out of 5
X96 X96Q PRO Smart TV BOX Dual Wifi 2Go+16Go Allwinner H616 6K,20.00 Dhs,46%,4.3 out of 5
Pack Microphone de Studio avec carte son V8 externe Bluetooth,"1,899.00 Dhs",59%,2.7 out of 5
tripod Trépied Télescopique en aluminium Pour Appareil Photo et smartphones + sacoche,178.00 Dhs,32%,3.7 out of 5
écran haut stockage étagère support TV moniteur Riser bureau support ordinateur,"1,471.00 Dhs",32%,4.8 out of 5
"Techmania Smart TV 40"" Android HD - Récepteur intégré + TNT + HDMI + USB - Garantie 1 An","1,367.00 Dhs",24%,4.1 out of 5
"Télescope Full HD 1500M /9500 M avec support smartphone camping,chasse+Sticker","1,034.00 Dhs",58%,4.6 out of 5
"Green Screen (3*1,5m) Arriere plan Fond Vert ChromaKey (Sans Cadre Stand)","1,234.00 Dhs",29%,5 out of 5
Support pour pc portable en aluminium ajustables en 7 positions multifonction,102.00 Dhs,53%,4.4 out of 5
"MK-X60 Clavier Gamer mécanique BLUE SWITCH, 87 touches, rétro-éclairage RGB",249.00 Dhs,39%,4.5 out of 5
Mini Ventilateur Portable à main 3 Mode Rechargeable USB câble,119.00 Dhs,57%,5 out of 5
Pack Combo Gaming Clavier + Souris 7D USB RGB,449.00 Dhs,45%,4 out of 5
Dml Casque Gamer  casque PC avec  son surround casque antibruit avec micro et lumière LED,"1,139.00 Dhs",80%,4.2 out of 5
mifoy GM100 Souris de jeu gamer PRO RGB Capteur Optique 1200 à 3200 DPI LED 6 boutons,"1,683.00 Dhs",78%,4.4 out of 5
Hoco Chargeur de Voiture Intelligent à Unique Port  USB,"1,949.00 Dhs",55%,3.4 out of 5
Câble DE Charge pour iphone /ipad,719.00 Dhs,35%,3.9 out of 5
mifoy M10 Souris Filaire Optique USB Effet Lumineuse RGB E-sport pour Ordinateur,369.00 Dhs,28%,5 out of 5
Hp PC GAMER i5 4éme Gén - 16GB RAM - 500GB HDD - NVIDIA GT 710 2GB - Windows 10 - remis à neuf,999.00 Dhs,56%,4.3 out of 5
"Casque Gamer Headset Gaming G9000 Lumière LED 3,5 mm Pour Telephone PS4 PC XBOX","2,450.00 Dhs",11%,4.2 out of 5
"Azami Tech Souris sans fil,rechargeable et silencieuse,Bluetooth éclairage LED RGB+Stickers Gratuit","2,389.00 Dhs",50%,4.3 out of 5
TP-Link Adaptateur USB et Clé WiFi à gain élevé 300Mbps TL-WN822N,269.00 Dhs,73%,4 out of 5
Razer Tapis de souris Plexus 900 x 300 MM Tapis gamer souris et clavier Gaming Mouse Pad,899.00 Dhs,34%,4.6 out of 5
mifoy Souris Gaming USB GM100 6 Boutons RGB Capteur Optique 1200 à 3200 DPI LED - Noir,269.00 Dhs,55%,4.6 out of 5
Laptop stand Support ordinateur portable en alliage d'aluminium réglable,259.00 Dhs,8%,4 out of 5
General Seringue pâte thermique 30 grammes pour processeur CPU PC Refroidisseur,79.00 Dhs,10%,4 out of 5
Tapis de souris fluide et souple Noir Antidérapant carbon,87.90 Dhs,63%,4 out of 5
"Onikuma Casque de Gamer compatible pour PS4, Xbox One, téléphones , PC",82.00 Dhs,16%,4.2 out of 5
Adaptateur hdmi vga - hdmi vert vga - hdmi to vga,90.00 Dhs,27%,4.8 out of 5
"Jedel Clavier mécanique gaming étroéclairé,RGB LED Backlit Switches+Sticker cadeau",132.00 Dhs,65%,3.6 out of 5
"haut-parleurs de musique avec lumière RVB pour PC, téléphone portable, TV,",50.00 Dhs,68%,3.8 out of 5
"Onikuma Casque de Gamer  avec microphone anti bruit ,compatible pour PS4, Xbox One, téléphones , PC",25.00 Dhs,43%,5 out of 5
Sac à Dos Anti-Vol pour Ordinateur Portable Appareil Photo Voyage Collège Loisirs Avec Port de Charge USB pour Homme Femme,259.00 Dhs,34%,4.7 out of 5
Jedel Clavier Silencieux RGB  gamer ergonomique rétroéclairés 104 touches multimédias K510 RGB sticker,73.90 Dhs,40%,4.2 out of 5
"Grand tapis de souris de jeu tapis de souris tapis de clavier, tapis de bureau Gamer, bureau",102.00 Dhs,52%,4 out of 5
Tapis de souris Repose-poignet souple pour ordinateur de bureau,119.00 Dhs,58%,4.6 out of 5
Adaptateur USB 3.0 de type-C,30.00 Dhs,34%,4.8 out of 5
100 sacs de conservation des aliments réutilisables élastiques a fermeture extensible,27.30 Dhs,79%,3.7 out of 5
Ingco Couteau à lames 61x19mm 6 lames,59.00 Dhs,21%,4.3 out of 5
"Mellerware Moulin COFFEE GRINDER MCG-151 pour Grains de Café, Noix, Épices",79.00 Dhs,47%,4.5 out of 5
Kenz Ventilateur au sol Silencieux no bruit 3 vitesse,170.00 Dhs,43%,3.6 out of 5
Kenz Balance de Cuisine - 1 g -10 kg pratique SD400,67.00 Dhs,16%,4.1 out of 5
Mellerware Panini grill multifonction appareil à sandwichs 750 W - 2ans de garantie,115.00 Dhs,54%,3.9 out of 5
tente Moustiquaire dôme pop-up pliable Anti-moustiques Pour Lit 2 places,128.00 Dhs,36%,4 out of 5
Taurus Fer à repasser JADE 2200W ceramic vapeur anti calcaire-2ans de garantie,199.00 Dhs,40%,4.6 out of 5
"2 pieces Porte-savon Vertical en forme de feuille, gris et vert",26.00 Dhs,42%,3.3 out of 5
"Climatiseur d'espace personnel, humidificateur mobile et ecologique",159.00 Dhs,47%,4 out of 5
Robolux Friteuse sans huile XXL - Air fryer tactile - 6L - 1800Watts - 6 programmes,710.00 Dhs,41%,4.2 out of 5
haie artificielle extensible brise-vue extensible en bois bonne  qualité,90.00 Dhs,64%,4.4 out of 5
"Bande Joint Sous Bas Porte Fenetre, Tapis Anti insectes Poussiere Souris Cafard",32.00 Dhs,35%,4.5 out of 5
TATCH Batteur Electrique 7 Vitesses,59.00 Dhs,30%,3.7 out of 5
"VACUUM sealer, Machine de scellage sous vide pour aliments ménagers et fruits",104.50 Dhs,23%,4.4 out of 5
Taurus Robot Mixeur Plongeant 600 inox plus3en1 accessoire Bol Hâchoir-2ans de garantie,279.00 Dhs,38%,5 out of 5
Taurus Fer à repasser BALTIC 1800w-2000w vapeur anti-calcaire - 2 ans de garantie,199.00 Dhs,38%,4 out of 5
KRÖHLER Ventilateur 3 en 1 au 3 positions: sur pied - posable ou mural,303.00 Dhs,13%,4.5 out of 5
Kenz Pack  Blender Bol En Verre 1.5L ICE Crush  G-lineshop article 9879,199.00 Dhs,23%,4.2 out of 5
Taurus Bouilloire en verre cristal Aroa Glass  1.7Lrotation360° 2200w-2 ans de garantie,249.00 Dhs,45%,4.1 out of 5
Prima Serpilliere Plastique Bleu,95.00 Dhs,26%,3.7 out of 5
"Taurus Panini grill multifonction MIAMI,appareil à sandwichs 700-800w-2 ans de garantie",140.00 Dhs,53%,1.3 out of 5
"Mini climatiseur à l'eau, humidificateur avec cable usb",189.00 Dhs,68%,3.5 out of 5
"Set 4 Cuillères spatule de cuisson de repas à la maison en bois avec seau de rangement pour poêle antiadhésive, en Bois bambou",29.00 Dhs,34%,4 out of 5
Affichage Intelligent de température de Thermos d'acier inoxydable bouteille d'eau intelligente,50.00 Dhs,75%,4.3 out of 5
Diffuseur Huiles Essentielles humidificateur d'air,69.00 Dhs,67%,4.3 out of 5
LwS> BALANCE KITCHEN ROND POUR LA CUISINE 1G TO 10KG,65.00 Dhs,46%,4 out of 5
Daiko Mixeur plongeant - 3 en 1 -  accessoires emulsifiant et hachoir,189.99 Dhs,31%,4.1 out of 5
"Bonomi Hachoir Electrique en INOX , Multifonction - 2 vitesses - 2L  4 lames aiguisé",145.00 Dhs,60%,4.5 out of 5
"Bouilloire électrique - Inox - 1,8 L",99.00 Dhs,26%,4.3 out of 5
Carton Box 100 pièces Carton d'emballage 22CM 12CM 15CM,149.00 Dhs,8%,4.3 out of 5
schlëizer Ventilateur sur pied de 16 pouces sans bruit,229.00 Dhs,47%,5 out of 5
Taurus Blender Bol en verre praktica 1300W mixeur robot inox-2 ans de garantie,399.00 Dhs,67%,3.6 out of 5
Homy SMART Blender Smoothie Maker Bol RESISTPLAST A Reliefs+ MoulineTTe A Épices/Café Meilleur Prix,99.00 Dhs,21%,4.8 out of 5
Tableau moderne Multi-colors pour salon 140 x 70 cm,189.00 Dhs,24%,5 out of 5
KRÖHLER Ventilateurs sur pied  - avec réglage de 3 vitesses,274.00 Dhs,39%,3.1 out of 5
Mellerware Panini grill multifonction appareil à sandwichs 750 W - 2ans de garantie,115.00 Dhs,54%,3.9 out of 5
Robolux Friteuse sans huile XXL - Air fryer tactile - 6L - 1800Watts - 6 programmes,710.00 Dhs,41%,4 out of 5
TATCH Batteur Electrique 7 Vitesses,59.00 Dhs,30%,4.5 out of 5
"VACUUM sealer, Machine de scellage sous vide pour aliments ménagers et fruits",104.50 Dhs,23%,3.7 out of 5
Taurus Robot Mixeur Plongeant 600 inox plus3en1 accessoire Bol Hâchoir-2ans de garantie,279.00 Dhs,38%,4.4 out of 5
Kenz Pack  Blender Bol En Verre 1.5L ICE Crush  G-lineshop article 9879,199.00 Dhs,23%,4 out of 5
Taurus Bouilloire en verre cristal Aroa Glass  1.7Lrotation360° 2200w-2 ans de garantie,249.00 Dhs,45%,4.5 out of 5
"Taurus Panini grill multifonction MIAMI,appareil à sandwichs 700-800w-2 ans de garantie",140.00 Dhs,53%,4.1 out of 5
Daiko Mixeur plongeant - 3 en 1 -  accessoires emulsifiant et hachoir,189.99 Dhs,46%,4.3 out of 5
"Bonomi Hachoir Electrique en INOX , Multifonction - 2 vitesses - 2L  4 lames aiguisé",145.00 Dhs,31%,4.3 out of 5
Siera Réfrigérateur avec congélateur en haut 190 Litres - Dp 27 Silver,"2,599.00 Dhs",6%,4.5 out of 5
"Bouilloire électrique - Inox - 1,8 L",99.00 Dhs,60%,4 out of 5
Taurus Blender Bol en verre praktica 1300W mixeur robot inox-2 ans de garantie,399.00 Dhs,47%,4.5 out of 5
Homy SMART Blender Smoothie Maker Bol RESISTPLAST A Reliefs+ MoulineTTe A Épices/Café Meilleur Prix,99.00 Dhs,67%,4.3 out of 5
Daiko Machine espresso 4en1 - 19 Bar - CAPSULE Nespresso - Dolci Gusto - Dosette,615.00 Dhs,39%,4.8 out of 5
Offfre Presse fruits électrique USB extracteur de jus pour tous les fruits,135.00 Dhs,55%,3.1 out of 5
Daiko Machine espresso 4en1 - 19 Bar - COMPATIBLE AVEC CAPSULE Nespresso - Dolci Gusto - Dosette,615.00 Dhs,49%,4.6 out of 5
Mmixeur de jus portable et rechargeable Usb Juice cup,83.99 Dhs,58%,3.1 out of 5
Daiko Mixeur plongeant - 4 en 1 -  accessoires emulsifiant et hachoir,169.99 Dhs,47%,3.8 out of 5
Daiko Machine espresso 4en1 - 19 Bar - CAPSULE Nespresso - Dolci Gusto - Dosette,614.99 Dhs,39%,4.4 out of 5
Taurus Hâchoir à viande 1200w 3 fonctions TURIN-2ans de garantie,599.00 Dhs,54%,3.6 out of 5
Taurus Robot pétrin multifonctions Perfecta  1200w-2ans de garantie,899.00 Dhs,31%,4.4 out of 5
Homy Ice Crush Blender Smoothie Maker Bol RESISTPLAST+ MoulineTTe A Épices/Café Meilleur Prix,99.00 Dhs,67%,3 out of 5
"Taurus Panini grill multifonction CHICAGO WHITE, appareil à sandwichs 1200W- 2 ans de garantie",272.00 Dhs,45%,4.2 out of 5
"Taurus Bouilloire Loiza 2200W 1,7L – 2 ans de garantie",159.00 Dhs,39%,3.9 out of 5
Hachoir à ail électrique portable Trancheuse à légumes multifonction,149.00 Dhs,47%,4.2 out of 5
Homy Batteur Mixeur Mélangeur Stéréo Polyvalent Puissant Moteur Cuivre 7Vts - Fouets + Crochets à Pâte,79.00 Dhs,43%,4.8 out of 5
Heinrich's Friteuse sans Huile - 8 Litres - 8 programmes-Ecran tactile LED - 1800W -Germany,"1,434.99 Dhs",14%,3.9 out of 5
Cooking Original Hachoir électrique 5L Litres/1200W Multifonction (Inox de haute qualité) Grand format,189.00 Dhs,39%,4.5 out of 5
"Taurus Friteuse sans huile AIR FRAY DIGITAL,3L, 1300W, 8 programmes-2ans de garantie","1,399.00 Dhs",69%,3.3 out of 5
Homy Blender Mixeur Verre A Reliefs +MoulineXette Épices + Smoothie Maker #Pas Cher,199.00 Dhs,28%,4.5 out of 5
Taurus Extracteur de Jus Fruits&Légumes 200W système anti-goutte-2ans de garantie,939.00 Dhs,46%,4.2 out of 5
Taurus Robot Mixeur Plongeant 600 inox + accessoire Bol Hâchoir-2ans de garantie,187.00 Dhs,45%,4.8 out of 5
Prima Mixeur Plongeur Plastique -350w,99.00 Dhs,28%,4.1 out of 5
KRÖHLER Cafetière électriques  PECM-617 Machine à café 6 tasses,129.00 Dhs,41%,4.4 out of 5
"Taurus Cafetière TRENTO, Machines à Café Expresso 20 BARRE -2ans de garantie",999.00 Dhs,17%,3.2 out of 5
Bonomi Gaufrier 225A petit 2 gaufres croustillantes et savoureuses,175.00 Dhs,35%,4.8 out of 5
"VACUUM sealer, Machine de scellage sous vide pour aliments ménagers et fruits",104.00 Dhs,50%,2.5 out of 5
Reef Sandale One Slide - Bleu,199.00 Dhs,50%,4.5 out of 5
Adidas Chaussure Basse Grand Court TD Blanche Hommes,399.00 Dhs,53%,4.5 out of 5
Adidas Pantalon de Survêtement Essentials 3 Bandes Noir Hommes,139.00 Dhs,58%,3.8 out of 5
Reef Sandales - Seaside - Tan/navy,277.00 Dhs,54%,4.2 out of 5
Adidas Sandales Confort Noires Hommes,285.00 Dhs,53%,4.1 out of 5
Adidas Chaussure Basse VS Pace Grise Hommes,209.00 Dhs,40%,3.5 out of 5
Reef Sandale Stash Slide Beige,139.00 Dhs,54%,4.5 out of 5
Adidas Sandales Adilette Noires Unisexe,399.00 Dhs,48%,4 out of 5
Adidas Chaussure de Running Duramo SL 2.0 Rose Unisexe,399.00 Dhs,53%,5 out of 5
Adidas Chaussure de Running Duramo 10 Verte Hommes,399.00 Dhs,53%,4.7 out of 5
Reef Sandales - Seaside - Black,331.00 Dhs,54%,4.8 out of 5
Adidas Chaussure de Running Duramo 10 Noire Hommes,408.00 Dhs,53%,3.9 out of 5
Adidas Chaussure Basse Grand Court TD Noire Hommes,180.00 Dhs,52%,4.4 out of 5
Adidas Chaussure de Running Duramo SL 2.0 Blanche Hommes,225.00 Dhs,53%,4.2 out of 5
Adidas Chaussure de Running Galaxy 6 Bordeaux Hommes,399.00 Dhs,52%,4.6 out of 5
Adidas Claquette Adilette Aqua Bleue Hommes,199.00 Dhs,52%,4.5 out of 5
Reef Sandale Stash Slide Vert,399.00 Dhs,50%,4.6 out of 5
Adidas Chaussure de Running Duramo 10 Bleue Hommes,239.00 Dhs,53%,4.5 out of 5
Reef Sandales - One Puff Slide -water/black,139.00 Dhs,44%,4.1 out of 5
Adidas Claquette Adilette Aqua Noire et Violette Unisexe,277.00 Dhs,52%,4.4 out of 5
Adidas T-shirt Essentials Petit Logo Brodé Blanc Hommes,414.00 Dhs,52%,4.1 out of 5
Adidas Claquette Adilette Aqua Noire Enfants,209.00 Dhs,57%,4.5 out of 5
Adidas Chaussure de Running Duramo 10 Noire et Blanche Hommes,285.00 Dhs,53%,5 out of 5
Adidas Sandales Confort Brunes Hommes,399.00 Dhs,53%,4.5 out of 5
Reef Sandales One Slide - Vert,399.00 Dhs,50%,4.3 out of 5
Adidas Lot de 3 Paires de Chaussettes Courtes Unisexe,139.00 Dhs,57%,4.3 out of 5
Adidas T-shirt Essentials Petit Logo Brodé Bleu Hommes,399.00 Dhs,60%,4.1 out of 5
Adidas Chaussure de Running Duramo SL 2.0 Rose et Orange Unisexe,408.00 Dhs,53%,4.5 out of 5
Adidas Claquette Adilette de Bain Bleue Hommes,399.00 Dhs,52%,4.3 out of 5
Birkenstock Tema Micro Fibre Black,331.00 Dhs,57%,4.3 out of 5
Reef Sandales- Seaside-navy,485.00 Dhs,54%,4.1 out of 5
Reef Sandales- One Slide-black/white,655.00 Dhs - 731.00 Dhs,46%,5 out of 5
Adidas Claquette Adilette Aqua Rose Femmes,237.00 Dhs,40%,4.4 out of 5
Reef Sandales - Switchfoot Lx-black Blue,249.00 Dhs,54%,5 out of 5
Reef Sandale One Slide - Bleu Nuit,265.00 Dhs,54%,4 out of 5
Reef Sandales- Seaside-grey,199.00 Dhs,54%,4.5 out of 5
Pack 12 Chaussettes Femmes Hommes   100 % Coton Bio,318.00 Dhs,67%,3.5 out of 5
Adidas Chaussure de Running Duramo SL 2.0 Noire Femmes,99.00 Dhs,53%,4.5 out of 5
Adidas Chaussure de Sport à Scratch Tensaur Noire et Blanche Enfants,99.00 Dhs,40%,4.7 out of 5
Adidas Claquette Racer TR Bleue Hommes,229.00 Dhs,52%,4.5 out of 5
Maybelline New York Pack Mascara Lash Sensational SKY HIGH + Tattoo Liner Crayon Gel,5.06 Dhs,49%,4 out of 5
L'Oréal Paris Elsève - Routine Hyaluron Repulp à l'acide Hyaluronique pour cheveux déshydratés,23.78 Dhs,32%,4.2 out of 5
Prosta miel 125ml +Prosta Herb 80g Pour Traiter l'inflation de la prostate,23.04 Dhs,42%,4.4 out of 5
NIVEA SUN Carotène- Huile Protectrice en spray Bronzage Intense - SPF 6 - 200ml,89.00 Dhs,31%,4.7 out of 5
L'Oréal Paris UV Defender - Photoprotection quotidienne hydratante à l'acide hyaluronique SPF 50+ Moisture Fresh - TROUSSE OFFERTE,105.00 Dhs,50%,4.2 out of 5
NIVEA MEN Déodorant Spray Homme - Fresh Ocean - 150ml,69.00 Dhs,22%,4.8 out of 5
Garnier Skin Active - Eau micellaire démaquillante tout en 1 Peaux Sensibles - 400ml = Trousse Jute OFFERTE,75.00 Dhs,50%,4.3 out of 5
Dove Pack de 2 gels douche 250ml / 1 acheté = 1 offert,16.00 Dhs,31%,4.6 out of 5
L'Oréal Paris UV Defender - Photoprotection quotidienne illuminante à la vitamine B3 SPF 50+ Instant Bright - TROUSSE OFFERTE,49.00 Dhs,31%,4.4 out of 5
L'Oréal Paris UV Defender - Photoprotection quotidienne matifiante à l'airlicium SPF 50+ Shine Control - TROUSSE OFFERTE,35.00 Dhs,40%,4.3 out of 5
Garnier Sérum Fast Bright à la vitamine C booster d'éclat pour teint terne - 15ml,75.00 Dhs,36%,4.6 out of 5
"Maybelline Rouge à lèvres Gloss Superstay Vinyl Ink 35 CHEEKY - 4,2ml",75.00 Dhs,34%,4.3 out of 5
Maybelline Lash Sensational SKY HIGH - Mascara longueur illimité et volume intense,39.00 Dhs,39%,4.7 out of 5
L'Oréal Paris Pack GLYCOLIC BRIGHT - Sérum Visage 1% d'Acide Glycolique + Crème de jour - SPF 17,89.00 Dhs,40%,4.4 out of 5
Maybelline Lifter Gloss - Brillant à lèvres liftant & repulpant à l'acide hyaluronique - ICE 02,85.00 Dhs,31%,4.1 out of 5
Garnier Ultra Doux - Hair Food - Masque nourissant au beurre de cacao pour cheveux bouclés - 390ml,159.00 Dhs,42%,4.4 out of 5
L'Oréal Paris Pack Hyaluron Expert : Sérum contour des yeux à l’acide hyaluronique 20ml + Sérum repulpant à l'acide hyaluronique 15ml,65.00 Dhs,36%,4.5 out of 5
NIVEA Lait Corps Beurre de Cacao - 2x250ml,55.00 Dhs,37%,4.6 out of 5
L'Oréal Paris Pack Routine Hyaluron Expert - Sérum + Gel Nettoyant À L'acide Hyaluronique Repulpant + Brosse Offerte,169.00 Dhs,52%,4.1 out of 5
Taurus Tondeuse Mithos Avant 4 fonctions - 2ans de garantie,75.00 Dhs,17%,4.4 out of 5
Garnier SkinActive - Eau micellaire pour peaux sensibles - 100ml,399.00 Dhs,42%,4.3 out of 5
Maybelline New York Instant Anti Age l'effaceur Anti-cernes correcteur fluide - 02 NUDE + Beauty Blender,449.00 Dhs,21%,4.2 out of 5
L'Oréal Paris Hyaluron Expert - Gel nettoyant à l'acide hyaluronique - 200ml,55.00 Dhs,36%,4 out of 5
"Maybelline Rouge à lèvres Gloss Superstay Vinyl Ink 15 PEACHY - 4,2ml",75.00 Dhs,42%,4.3 out of 5
Maybelline New York Instant Anti Age l'effaceur Anti-cernes correcteur fluide - 00 IVORY + Beauty Blender,178.90 Dhs,31%,4.2 out of 5
L'Oréal Paris Gel Nettoyant Moussant Glycolic Bright - 100 Ml,65.00 Dhs,41%,4.4 out of 5
Philips Brosse Lissante-Cheveux,286.00 Dhs,30%,5 out of 5
Philips Tondeuse One blade QP2510/10,550.00 Dhs,30%,4.2 out of 5
Maybelline New York Mascara The Falsies - Lash Lift - Noir,159.00 Dhs,39%,4.2 out of 5
L'Oréal Paris L'oréal Paris - Hyaluron Expert Soin Repulpant Hydratant - Jour Spf 20 - 50 Ml,45.00 Dhs,41%,4.1 out of 5
L'Oréal Paris L'oréal Paris - Hyaluron Expert Crème De Nuit Hydratante Et Repulpante À L'acide Hyaluronique 50 Ml,75.00 Dhs,24%,4.3 out of 5
Maybelline Pack Teint - Fond de teint SPF 50 Fit me Fresh Tint 05 + Fit me Concealer 25 Medium,49.00 Dhs,38%,4.4 out of 5
Maybelline New York Maybelline New York - Rouge À Lèvre Mat Liquide - Longue Tenue - Superstay Matte Ink Pinks - 15 Lover - 5 Ml,75.00 Dhs,38%,4.6 out of 5
"NIVEA SUN Spray Protect & Hydrate SPF 50+ Trigger, 270ml",169.00 Dhs,39%,4.4 out of 5
Maybelline New York Crayon The Colossal Kajal - Black,35.00 Dhs,31%,4.4 out of 5
"Maybelline New York Anti-cernes Correcteur Fluide - Fit Me - Tous types de peaux - 25 MEDIUM - 6,8 ml",49.00 Dhs,38%,4.2 out of 5
Maybelline Pack Teint - Fond de teint SPF 50 Fit me Fresh Tint 03 + Fit me Concealer 20 Sand,55.00 Dhs,73%,4.1 out of 5
Rockstar Grand Theft Auto V GTA 5 PS4 Édition Premium,275.00 Dhs,12%,5 out of 5
Sony Console PS5 Edition Standard,478.00 Dhs,21%,4.2 out of 5
Manette PS4 sans fil DualShock 4 Noir / PSTV / PS4 / PS Consoles,235.99 Dhs,52%,5 out of 5
EA Sports FIFA 23 Nintendo Switch FR,849.00 Dhs,60%,3.5 out of 5
Electronic Arts FIFA 23 Standard Edition PS4,499.00 Dhs,50%,5 out of 5
"Support multifonctionnel universel PS5, 2 manettes de jeu , ventilateur de refroidissement,",249.00 Dhs,45%,3.5 out of 5
Electronic Arts FIFA 23 ps4,619.00 Dhs,43%,5 out of 5
"Console de jeu vidéo sans fil, Retro avec 10000 jeux des années 80 et 90 + 2 Manettes",499.00 Dhs,44%,4.5 out of 5
Manette Xbox 360 Manette Filaire Noir / XBOX 360 / PC WIN 7 10,"2,599.00 Dhs",60%,4.6 out of 5
Nintendo Switch The Legend of Zelda Tears Of The Kingdom,95.00 Dhs,24%,4 out of 5
