product,price,reduction,evaluation
EA Sports FIFA 23 PS4 FR,258.90 Dhs,27%,5 out of 5
Ea FIFA 23 PS4,399.00 Dhs,30%,4.5 out of 5
Rockstar Games Grand Theft Auto V GTA 5 PS4,249.00 Dhs,27%,4.5 out of 5
Nintendo Switch Super Mario Odyssey,28.00 Dhs,34%,4.9 out of 5
Manette PC Gaming Port USB Pour s'amuser avec les émulateurs PlayStation,435.00 Dhs,65%,5 out of 5
Manette Playstation 3 - Dualshock 3 Double Vibration sans fil by Lharass,141.00 Dhs,21%,4.8 out of 5
Manette Playstation 4 DOUBLESHOCK PS4 + USB,799.00 Dhs,35%,4.8 out of 5
Licensed Nintendo Console Nintendo Switch Lite Bleu ( nouvelle couleur ),995.00 Dhs,24%,5 out of 5
Azami Tech MANETTE PS4 PLAYSTATION 4 SANS FIL DUALSHOCK 4 - gladiator,"3,650.00 Dhs",50%,5 out of 5
Incassable Film Vitre Protection Ecran pour Nintendo Switch OLED Verre Trempé,475.00 Dhs,21%,3.1 out of 5
Santa Monica Studio God of War PS4,499.00 Dhs,48%,3 out of 5
Rockstar Games Gta 5 Edition Reissue PS5,299.00 Dhs,34%,5 out of 5
Playstation Red Dead Redemption 2 PS4,170.00 Dhs,18%,4.5 out of 5
Capuchon en Silicone Analogue de Manette de Jeux ps4/ps5,436.00 Dhs,44%,4.6 out of 5
Manette PS4 sans fil DualShock 4 / PSTV / PS4 / PS Consoles - Noir,499.00 Dhs,39%,4.7 out of 5
Azami Tech MANETTE PS4 PLAYSTATION 4 SANS FIL DUALSHOCK 4 - gladiator,249.00 Dhs,41%,5 out of 5
Playstation The Last Of Us Part II PS4,399.00 Dhs,24%,4.4 out of 5
iwahome Volant multimarque,299.00 Dhs,22%,5 out of 5
Skin Sticker carbon pour PlayStation 4 Slim,28.00 Dhs,11%,5 out of 5
EA Sports FIFA 23 PS5,525.00 Dhs,18%,2 out of 5
Adidas Chaussure Advantage Base Blanche et Verte Hommes,379.00 Dhs,53%,4.5 out of 5
Adidas Short de Bain CLX Solid Bleu Royale Hommes,370.00 Dhs,60%,4.1 out of 5
Adidas Chaussure Advantage Base Blanche Hommes,139.00 Dhs,52%,4.7 out of 5
Adidas Short de Bain CLX Solid Noir Hommes,323.00 Dhs,59%,3.8 out of 5
Adidas Pantalon de Survêtement 3 Bandes Gris Hommes,132.00 Dhs,58%,4.2 out of 5
Adidas Short de Bain CLX Solid Bleu Hommes,398.00 Dhs,52%,4.5 out of 5
Adidas Chaussure Advantage Base Noire Hommes,239.00 Dhs,53%,4.1 out of 5
Adidas Short De Bain Bold 3 Bandes Bleu Royale Hommes,219.00 Dhs,52%,4.4 out of 5
Adidas Chaussure Breaknet Blanche et Noire Hommes,198.00 Dhs,50%,4.3 out of 5
Adidas Chaussure Grand Court Base Blanche et Noire Hommes,696.00 Dhs,53%,4.3 out of 5
TENTE DE CAMPING 4 PERSONNES 208x208x145 cm,239.00 Dhs,74%,3.7 out of 5
Set d'haltères en Vinyl - 10 KG,30.00 Dhs,51%,4.2 out of 5
Adidas Maillot de Football Core 18 Blanc Hommes,164.00 Dhs,53%,4.7 out of 5
Bsh Corde à Sauter PROFESSIONNEL Noir BSH,199.00 Dhs,54%,3.6 out of 5
Tente automatique a ouverture rapide (Pop-Up) avec porte moustiquaire,396.00 Dhs,58%,3.6 out of 5
2pcs JawLine exerciseur balle faciale mâchoire Muscle Toner entraînement Fitness Anti-âge,110.00 Dhs,44%,3.3 out of 5
Iron Gym Barre Fixe de traction Multi Fonctions en métal,115.00 Dhs,13%,3.4 out of 5
1 paire bouchons d'oreilles souples de natation piscine Sport plage surf,119.00 Dhs,68%,3.2 out of 5
"Couteau de chasse, couteau tactique, couteau de poche, Couteau de Camping",119.00 Dhs,61%,3.5 out of 5
Adidas Ballon de Football Starlancer Noir et Vert,160.00 Dhs,40%,3.9 out of 5
Tentes de Camping 4 PERSONNES Multicouleurs 208x208x145 cm,175.00 Dhs,37%,3.3 out of 5
Bsh haltères de musculation 30 kg plus une barre,180.00 Dhs,32%,4.1 out of 5
"Pakka Bandes soutien poignets strap pour tirage, pour barre fixe et deadlift",180.00 Dhs,41%,5 out of 5
Adidas Short De Bain Bold 3 Bandes Bleu Hommes,180.00 Dhs,60%,3.6 out of 5
Résistance à 150 LBS - Kit de Bandes Élastique Fitness,180.00 Dhs,54%,5 out of 5
Dynamic Barre fixe réglable en aluminium,180.00 Dhs,19%,5 out of 5
Adidas Ballon de Football Starlancer Club Bleu et Blanc Hommes,190.00 Dhs,40%,3.2 out of 5
Ceinture gilet thermoforming adjustable pour les femmes,190.00 Dhs,60%,5 out of 5
Adidas Short Essentials Aeroready Chelsea 3 Bandes Bleu Marine Hommes,190.00 Dhs,54%,4.5 out of 5
3pcs Resistance Bands Hip Circle Anti Slip Rubber Band Hip Circle Loop Resistanc,190.00 Dhs,73%,4.2 out of 5
Pakka Gants Musculation et cyclisme pour hommes  et femmes en Cuir et Daim - Noir,370.00 Dhs,51%,3.2 out of 5
Hamacs de jardin en coton confortable + sac de transport,116.00 Dhs,72%,2.8 out of 5
Resistance Majestic fitness kit de Bandes Élastique Fitness Résistance -150 LBS 11 Pièces Bon Qualité,379.00 Dhs,44%,3.5 out of 5
"Couteau de chasse, couteau tactique, couteau de poche, Couteau de Camping",142.00 Dhs,40%,3.7 out of 5
Bsh Elastique fitness BSH MULTI FONCTION,239.00 Dhs,40%,4.8 out of 5
Pakka Gants de Boxe Pour hommes et Femmes - Noir,139.00 Dhs,25%,5 out of 5
Pakka CEINTURE MUSCULATION EN CUIR MARRON,370.00 Dhs,67%,5 out of 5
Resistance Majestic fitness kit de Bandes Élastique Fitness Résistance -150 LBS 11 Pièces Bon Qualité,180.00 Dhs,44%,5 out of 5
POT DE TOILETTE ET DE VOYAGE PLIANT REDUCTEUR DE TOILETTE POT D'APPRENTISSAGE,85.00 Dhs - 99.00 Dhs,33%,5 out of 5
Cactus Dansants   Rechargrable avec  musique enregistrée et répète la parole,29.00 Dhs,58%,4.5 out of 5
"Tapis de gymnastique Piano pour bébé, Tapis de jeu pour bébé, cadeau pour BéBé 2022",72.25 Dhs,35%,3.8 out of 5
"Lit bébé pliable portable, moustiquaire et oreiller",54.00 Dhs,24%,4 out of 5
"Chapeau douche de protection des Yeux et Visage de Shampooing pour bébé, casquette de douche",105.00 Dhs,3%,5 out of 5
ULTRACUBE 3 mm  classique 216 billes Boules Magnétiques Cube Fidget Gadget,143.95 Dhs,68%,4.3 out of 5
"Chapeau réglable multifonction pour enfants bébé ( Douche,rasage,soleil...)",33.00 Dhs,40%,2.3 out of 5
"Swan Chaise haute bébé avec tablette et ceinture de sécurité, supporte 25kg -BLANC",47.00 Dhs,37%,5 out of 5
"Tapis de jeu pour bébé enfant, gonflable, Développement des capacités motrices",54.00 Dhs,41%,4.3 out of 5
"Baby Carrier bleu multifonctions, Porte bébé, Multiposition",107.00 Dhs,81%,4.2 out of 5
Bracelet anti perte pour enfant -,99.00 Dhs - 114.00 Dhs,46%,4 out of 5
Chapeau Anti-collision de protection de tête pour bébé,34.00 Dhs,10%,3.9 out of 5
100 pcs étoiles lumineuses multicouleurrs,172.00 Dhs,35%,3.3 out of 5
"Tablette de dessin Magic 3D pour enfants,colorée,lumineuse,peinture,Pad Deluxe",79.00 Dhs,13%,3.8 out of 5
"Galaxy Projecteur Galaxy pour chambre à coucher, projecteur led ciel - étoile - réveil - baf bluetooth",187.00 Dhs,45%,4.6 out of 5
Coffret de 12 pots de slimes avec un petit dinosaure dendans multicouleurs,199.00 Dhs,40%,3.4 out of 5
Pack 3 Lampes Veilleuses de Nuit sans fil avec télécommande,70.00 Dhs,53%,3.9 out of 5
Pok  Avec Jouets éducatifs précoces anneau arc-en-ciel bois empilable montessori,165.00 Dhs,50%,5 out of 5
Tapis Musical Babygym  d'Éveil Piano pour Bébé,76.50 Dhs,46%,2.7 out of 5
Projecteur d'étoiles plus 21 modes d'éclairage avec télécommande,37.00 Dhs,62%,4 out of 5
coussin de grossesse bleu/rose,92.00 Dhs,21%,4 out of 5
"4* Protections Coin de Table pour Bébé,Angle pour Meuble Molles & Rondes - 4 pièces",37.90 Dhs,34%,3 out of 5
Cache Prise Bébé pour la Sécurité des Enfants,359.00 Dhs,20%,3.5 out of 5
Birkenstock Rio Kids BFBC Lavender Blush,77.00 Dhs,39%,3.5 out of 5
Mustela Lingettes de Coton Bio à l'Eau certifiées BIO,87.90 Dhs,43%,3.7 out of 5
tapis d'éveil gonflable eau pour bébé inflatable BABY WATER MAT,35.79 Dhs,25%,3 out of 5
MIXA BEBE Lingettes ultra doux au lait de toilettes pour nourrissant nettoie et hydrate,99.00 Dhs,28%,3 out of 5
Amazona Chapeau de bain réglable pour enfants bébé Shampoing De Douche,18.90 Dhs,40%,4 out of 5
"Chaise coussin toilette pour enfants,siège de toilette avec echelle,pot bébé",45.85 Dhs,33%,4 out of 5
Omo Offre Exclusive - Détergent Machine Liquide Active Fresh 3.9L,15.00 Dhs,38%,4.5 out of 5
Red Bull Energy Drink 25cl,32.00 Dhs,27%,4.2 out of 5
Kinder Kinder - Chocolat Country 23g,9.60 Dhs,44%,3.5 out of 5
Sprite Sprite - Pack 24x33cl,38.72 Dhs,32%,4.5 out of 5
Clorets Clorets – Cinnamint 10 unités,14.79 Dhs,34%,5 out of 5
Dari Dari – Couscous Moyen 500G,10.70 Dhs,46%,4.4 out of 5
Enmer Enmer - Sucre Morceaux 1 kg,18.97 Dhs,45%,4.4 out of 5
"Ferrero Rocher Ferrero Rocher - Chocolat T3 37,5g",9.84 Dhs,17%,2.3 out of 5
Sidi Ali Sidi Ali - Eau minérale 2lx4,11.09 Dhs,17%,4.3 out of 5
PANDOO Pandoo - Papier Hygiènique 7+2 unités Gratuites,25.80 Dhs,43%,4.5 out of 5
Dari Dari - Couscous Fin 500g,31.20 Dhs,11%,4.8 out of 5
Omo Lot de 2 Lessives Liquides Active 2.5L,28.80 Dhs,36%,3.5 out of 5
Chocodate Chocodate - coconut 100g,14.50 Dhs,22%,4.8 out of 5
Kinder Kinder - Tronky T5,9.60 Dhs,22%,5 out of 5
"Nestlé KITKAT Kitkat - 4 Finger 36,5g",11.10 Dhs,17%,4.3 out of 5
Nestlé KITKAT Kitkat - 4 Fingers,16.74 Dhs,24%,4 out of 5
Redbull Redbull - Energy Drink 25cl,10.40 Dhs,20%,4.5 out of 5
Coca-cola Coca Zero Sucre Pack 12x50cl,38.72 Dhs,37%,3.8 out of 5
Indomie Indomie - Lot 5 en 1 Nouilles Sautees 80g*5,14.50 Dhs,48%,5 out of 5
Panzani Panzani - Sauce Olive Basil 400g,12.20 Dhs,33%,4.5 out of 5
Alsa Alsa - Flan Chocolat Etui 45g,11.60 Dhs,17%,4.6 out of 5
Tam Tam - Thon à L'Huile 3x85g,11.60 Dhs,22%,4.5 out of 5
Nutella Nutella - Pâte À Tartiner 200g,12.20 Dhs,36%,4.5 out of 5
Indomie Indomie - Lot  Nouilles 5 en 1 Poulet Citron 5x70g,10.70 Dhs,17%,4 out of 5
Gullon Gullon - Mini Fish 350g,11.70 Dhs,32%,1 out of 5
ONCLE SAM Oncle Sam - Pois Chiches 1kg,60.60 Dhs,36%,4.4 out of 5
Indomie Indomie - Lot Nouilles 5 en 1 Poulet 5x70g,38.72 Dhs,17%,3.8 out of 5
Ciel Pack Eau de table 1.5L*6,4.04 Dhs,33%,5 out of 5
Skip Capsules lave linge SKIP 46p,11.00 Dhs,26%,4.4 out of 5
AIN IFRANE Ain Ifrane - Eau Minerale Naturelle 5l,135.36 Dhs,55%,4.8 out of 5
Clorets Clorets – Lemon Mint 10 unités,16.20 Dhs,13%,3.2 out of 5
"Exet Exet - Maison Rose 2,5l",23.41 Dhs,29%,4.3 out of 5
Omo Lot de 2 Lessives Liquides au savon de Marseille - 2x2.5L,26.40 Dhs,19%,4.8 out of 5
ACE Ace - Nettoyant Sol Manzili Lavande 1l,3.32 Dhs,23%,4 out of 5
Idéal Ideal - Bennat Tiab Safran 5*2c,12.00 Dhs,17%,4.1 out of 5
Oulmes Oulmes - 1l,61.20 Dhs,33%,3.4 out of 5
DAMTI Damti - Sachet Sauce Bechamel Nature 80g,28.80 Dhs,23%,3.6 out of 5
